{
  "catalog_version": "1.0.0",
  "library_version": "0.1.0",
  "updated": "2026-10-15",
  "notes": "Foundation catalog. Visual animation components are added as each development-plan part is implemented and tested. Do not mark entries tested until automated checks pass.",
  "components": [
    {
      "id": "design.theme.quonitron_dark",
      "name": "QUONITRON Dark Theme",
      "category": "design",
      "tags": [
        "theme",
        "palette",
        "typography",
        "dark",
        "editorial",
        "design-system"
      ],
      "aliases": [
        "default theme",
        "quonitron dark",
        "brand colors"
      ],
      "description": "Default premium dark editorial theme: semantic colors, type hierarchy, spacing, stroke, and motion tokens used by all later components.",
      "module": "quonitron.design.tokens",
      "class_name": "Theme",
      "parameters": {
        "name": {
          "type": "string",
          "description": "Registered theme key",
          "default": "quonitron_dark"
        }
      },
      "defaults": {
        "name": "quonitron_dark"
      },
      "dependencies": [],
      "compatibility": {
        "manim": ">=0.18,<1.0",
        "python": ">=3.10"
      },
      "test_status": "unit_ok",
      "example": "from quonitron.design import get_theme\ntheme = get_theme()\nbg = theme.color('background')",
      "limitations": "Does not render pixels by itself. Font names are fallbacks; exact glyph metrics vary by OS.",
      "related_ids": [],
      "part": 0
    },
    {
      "id": "base.component",
      "name": "Base Component",
      "category": "base",
      "tags": [
        "base",
        "registry",
        "component",
        "api"
      ],
      "aliases": [
        "component base class"
      ],
      "description": "Theme-aware base class and metadata contract for reusable animation components. Visual subclasses are added in later parts.",
      "module": "quonitron.components.base",
      "class_name": "BaseComponent",
      "parameters": {
        "theme": {
          "type": "Theme | None",
          "description": "Optional theme override. Defaults to the registered default theme."
        }
      },
      "defaults": {},
      "dependencies": [
        "design.theme.quonitron_dark"
      ],
      "compatibility": {
        "manim": ">=0.18,<1.0",
        "python": ">=3.10"
      },
      "test_status": "unit_ok",
      "example": "from quonitron.components import BaseComponent\ncomp = BaseComponent()\ncomp.ensure_built()",
      "limitations": "Not a Manim VGroup. Later visual components may wrap or compose VGroups.",
      "related_ids": [
        "design.theme.quonitron_dark"
      ],
      "part": 0
    }
  ]
}
